nomcurs,desccurscat,codiarea,duradacurs,personesdest,requisits,temari,sortides,titulacio,codimodalitat,nommodalitat,financiacio,datainici,preinscripcio,nomcentre,codimunicipi,adrecacentre,latitud,longitud,telefon,correu,web,codipostal,codicentre,departament,desccurses,mes
Fleca i brioixeria,"Conduir i realitzar les operacions d'elaboració de productes de fleca i brioixeria, aconseguint els objectius de producció i qualitat establerts, respectant en tot moment la normativa vigent técnic- sanitària, ambiental i de seguretat i higiene en e",IAF,450.0,Demandant d'ocupació no ocupat,https://serveiocupacio.gencat.cat/ca/persones/vull-formar-me/certificats-professionals/,https://sede.sepe.gob.es/es/portaltrabaja/resources/pdf/especialidades/INAF0108.pdf,"Forner/a Operador/a de màquines per elaborar productes de fleca i rebosteria industrial, en general Operador/a de forns de fleca i rebosteria industrial Operador/a de màquines envasadores de productes de fleca i rebosteria industrial Operador/a de màquines de control per a la producció d'articles de fleca i rebosteria industrial Elaborador/a de brioixeria Elaborador/a de masses i bases de pizzes Treballadors relacionats amb el processament d'aliments",Certificat de Professionalitat/Acreditació parcial acumulable,Presencial,Presencial,Sí,2024-12-19,https://serveiocupacio.gencat.cat/ca/persones/vull-formar-me/cercadors-formacio-especialitats/cercador-integrat/fitxa-curs.html?nomCurso=/0189725/002&codi_curso_seleccionado=24/CIFOCS_ED/707/0189725/002,CIFO Salt,17155,CR Alfons Moré 1,41.972965,2.801202,972405570,cifo_salt.soc@gencat.cat,https://serveiocupacio.gencat.cat/cifosalt,17190,12383.0,SOC,"Conduir i realitzar les operacions d'elaboració de productes de fleca i brioixeria, aconseguint els objectius de producció i qualitat establerts, respectant en tot moment la normativa vigent técnic- sanitària, ambiental i de seguretat i higiene en e",12.0
Sistema de millora contínua LEAN a la indústria química,Contacteu amb l'entitat,QUE,40.0,Demandant d'ocupació no ocupat,https://serveiocupacio.gencat.cat/ca/persones/vull-formar-me/certificats-professionals/,https://sede.sepe.gob.es/es/portaltrabaja/resources/pdf/especialidades/QUIE03.pdf,,Certificat d'assistència,Presencial,Presencial,Sí,2024-11-29,https://serveiocupacio.gencat.cat/ca/persones/vull-formar-me/cercadors-formacio-especialitats/cercador-integrat/fitxa-curs.html?nomCurso=/0187343/002&codi_curso_seleccionado=24/CIFOFSE/702/0187343/002,CIFO Tarragona,43148,CM de la Budallera s/n,41.143463,1.291791,977251566,cifo_tarragona.soc@gencat.cat,https://serveiocupacio.gencat.cat/cifotarragona,43007,12385.0,SOC,Contacteu amb l'entitat,11.0
Socorrisme en instal·lacions aquàtiques,Contacteu amb l'entitat,AEP,290.0,Demandant d'ocupació no ocupat,https://serveiocupacio.gencat.cat/ca/persones/vull-formar-me/certificats-professionals/,https://sede.sepe.gob.es/es/portaltrabaja/resources/pdf/especialidades/AFDP0109.pdf,,Certificat de Professionalitat/Acreditació parcial acumulable,Presencial,Presencial,Sí,2025-04-01,https://serveiocupacio.gencat.cat/ca/persones/vull-formar-me/cercadors-formacio-especialitats/cercador-integrat/fitxa-curs.html?nomCurso=/0189361/007&codi_curso_seleccionado=24/ATCC1/711/0189361/007,ALTESPORT 2000 SL,43905,CR VIA ROMA 25,41.08837,1.091557,977380203,ALTESPORT@ALTESPORT.COM,,43850,32839.0,SOC,Contacteu amb l'entitat,4.0
Activitats auxiliars de comerç,Contacteu amb l'entitat,CMT,230.0,Demandant d'ocupació no ocupat,https://serveiocupacio.gencat.cat/ca/persones/vull-formar-me/certificats-professionals/,https://sede.sepe.gob.es/es/portaltrabaja/resources/pdf/especialidades/COMT0211.pdf,,Certificat de Professionalitat/Acreditació parcial acumulable,Presencial,Presencial,Sí,2024-10-03,https://serveiocupacio.gencat.cat/ca/persones/vull-formar-me/cercadors-formacio-especialitats/cercador-integrat/fitxa-curs.html?nomCurso=/0184326/061&codi_curso_seleccionado=23/FOAP/680/0184326/061,INSTITUT CATALA ENSENYAMENT INDUSTRIAL S.L.,08101,CR SANTA EULALIA 174,41.3654,2.122147,0934227088,y.roch@icei-formacion.com,http://www.instcat.com,08902,1882.0,SOC,Contacteu amb l'entitat,10.0
Formació sobre Tacògraf Digital (Formació Complementària CAP Mercaderies i Viatgers),Contacteu amb l'entitat,TMI,8.0,Demandant d'ocupació no ocupat,https://serveiocupacio.gencat.cat/ca/persones/vull-formar-me/certificats-professionals/,https://sede.sepe.gob.es/es/portaltrabaja/resources/pdf/especialidades/TMVI31.pdf,,Certificat d'assistència,Presencial,Presencial,Sí,2024-12-09,https://serveiocupacio.gencat.cat/ca/persones/vull-formar-me/cercadors-formacio-especialitats/cercador-integrat/fitxa-curs.html?nomCurso=/0184075/029&codi_curso_seleccionado=23/FOAP/680/0184075/029,AUTOESCOLA MATADEPERA S.L,08279,CT MONTCADA 180,41.557205,2.013345,937835678,SECCIO04@AUTOESCOLAMATADEPERA.CAT,http://autoescolamatadepera.cat/,08223,26298.0,SOC,Contacteu amb l'entitat,12.0
Socorrisme en espais aquàtics naturals,Contacteu amb l'entitat,AEP,340.0,Demandant d'ocupació no ocupat,https://serveiocupacio.gencat.cat/ca/persones/vull-formar-me/certificats-professionals/,https://sede.sepe.gob.es/es/portaltrabaja/resources/pdf/especialidades/AFDP0209.pdf,,Certificat de Professionalitat/Acreditació parcial acumulable,Presencial,Presencial,Sí,2024-09-16,https://serveiocupacio.gencat.cat/ca/persones/vull-formar-me/cercadors-formacio-especialitats/cercador-integrat/fitxa-curs.html?nomCurso=/0189589/004&codi_curso_seleccionado=24/FPOIES_23_24/714/0189589/004,INSTITUT CAL·LIPOLIS,43148,AU TARRAGONA-SALOU S/N,41.102863,1.204251,977544202,INSTITUT@INSTITUTCALLIPOLIS.CAT,,43006,3755.0,SOC,Contacteu amb l'entitat,9.0
Activitats auxiliars de magatzem,Contacteu amb l'entitat,CML,170.0,Demandant d'ocupació no ocupat,https://serveiocupacio.gencat.cat/ca/persones/vull-formar-me/certificats-professionals/,https://sede.sepe.gob.es/es/portaltrabaja/resources/pdf/especialidades/COML0110.pdf,,Certificat de Professionalitat/Acreditació parcial acumulable,Presencial,Presencial,Sí,2024-10-21,https://serveiocupacio.gencat.cat/ca/persones/vull-formar-me/cercadors-formacio-especialitats/cercador-integrat/fitxa-curs.html?nomCurso=/0184326/073&codi_curso_seleccionado=23/FOAP/680/0184326/073,INSTITUT CATALA ENSENYAMENT INDUSTRIAL S.L.,08101,CR SANTA EULALIA 174,41.3654,2.122147,0934227088,y.roch@icei-formacion.com,http://www.instcat.com,08902,1882.0,SOC,Contacteu amb l'entitat,10.0
Serveis bàsics de barres i sala a la restauració,Contacteu amb l'entitat,HTR,20.0,Demandant d'ocupació no ocupat,https://serveiocupacio.gencat.cat/ca/persones/vull-formar-me/certificats-professionals/,https://sede.sepe.gob.es/es/portaltrabaja/resources/pdf/especialidades/HOTR26.pdf,,Certificat d'assistència,Presencial,Presencial,Sí,2025-04-28,https://serveiocupacio.gencat.cat/ca/persones/vull-formar-me/cercadors-formacio-especialitats/cercador-integrat/fitxa-curs.html?nomCurso=/0189552/023&codi_curso_seleccionado=24/ATCC2/712/0189552/023,CONSULTORIA INCORPORA,08089,CR Sant Isidre 66,41.281376,1.981161,938029983,raimon@consultoriaincorpora.com,,08860,46233.0,SOC,Contacteu amb l'entitat,4.0
Seguretat i tècniques en treballs en alçada,Contacteu amb l'entitat,SMD,40.0,Demandant d'ocupació no ocupat,https://serveiocupacio.gencat.cat/ca/persones/vull-formar-me/certificats-professionals/,https://sede.sepe.gob.es/FOET_CATALOGO_EEFF_SEDE/flows/main?execution=e1s1,,Certificat d'assistència,Presencial,Presencial,Sí,2024-12-11,https://serveiocupacio.gencat.cat/ca/persones/vull-formar-me/cercadors-formacio-especialitats/cercador-integrat/fitxa-curs.html?nomCurso=/0187168/042&codi_curso_seleccionado=24/CIFOFSE/702/0187168/042,CIFO Vallès,08279,"CT N-150, km 15",41.63159,2.29423,937362910,cifo_valles.soc@gencat.cat,https://serveiocupacio.gencat.cat/cifosabadell,08520,12382.0,SOC,Contacteu amb l'entitat,12.0
Atenció sociosanitària a persones dependents en institucions socials,"Atendre persones dependents en l'àmbit sociosanitari en la institució on es desenvolupi la seva actuació, aplicant les estratègies dissenyades per l'equip interdisciplinari competent i els procediments per mantenir i millorar la seva autonomia perso",SCG,370.0,Demandant d'ocupació no ocupat,https://serveiocupacio.gencat.cat/ca/persones/vull-formar-me/certificats-professionals/,https://sede.sepe.gob.es/es/portaltrabaja/resources/pdf/especialidades/SSCS0208.pdf,"Cuidador/a de minusvàlids físics, psíquics i sensorials Cuidador/a de persones dependents en institucions Gericultor/a",Certificat de Professionalitat/Acreditació parcial acumulable,Presencial,Presencial,Sí,2024-11-11,https://serveiocupacio.gencat.cat/ca/persones/vull-formar-me/cercadors-formacio-especialitats/cercador-integrat/fitxa-curs.html?nomCurso=/0188600/004&codi_curso_seleccionado=24/ATCC2/712/0188600/004,"ÀBAC FORMACIó, S.L.",25120,CR Pica d'Estats 22,41.61793,0.615412,973281788,PAU@ABACFORMACIO.COM,http://WWW.ABACFORMACIO.COM,25006,1968.0,SOC,"Atendre persones dependents en l'àmbit sociosanitari en la institució on es desenvolupi la seva actuació, aplicant les estratègies dissenyades per l'equip interdisciplinari competent i els procediments per mantenir i millorar la seva autonomia perso",11.0
"Implantació i gestió d'elements informàtics en sistemes domòtics/immòtics, de control d'accessos i presència, i de videovigilància",Contacteu amb l'entitat,ICT,150.0,Demandant d'ocupació no ocupat,https://serveiocupacio.gencat.cat/ca/persones/vull-formar-me/certificats-professionals/,https://sede.sepe.gob.es/es/portaltrabaja/resources/pdf/especialidades/IFCT0409.pdf,,Certificat de Professionalitat/Acreditació parcial acumulable,Presencial,Presencial,Sí,2024-10-28,https://serveiocupacio.gencat.cat/ca/persones/vull-formar-me/cercadors-formacio-especialitats/cercador-integrat/fitxa-curs.html?nomCurso=/0189760/001&codi_curso_seleccionado=24/FPOIES_23_24/714/0189760/001,IES CAPARRELLA,25120,ZO PARTIDA DE LA CAPARRELLA 98,41.596783,0.581966,973288180,c5002799@xtec.cat,http://www.iescaparrella.cat,25192,2810.0,SOC,Contacteu amb l'entitat,10.0
Confecció i publicació de pàgines web,Contacteu amb l'entitat,ICD,480.0,Demandant d'ocupació no ocupat,https://serveiocupacio.gencat.cat/ca/persones/vull-formar-me/certificats-professionals/,https://sede.sepe.gob.es/es/portaltrabaja/resources/pdf/especialidades/IFCD0110.pdf,,Certificat de Professionalitat/Acreditació parcial acumulable,Presencial,Presencial,Sí,2024-11-18,https://serveiocupacio.gencat.cat/ca/persones/vull-formar-me/cercadors-formacio-especialitats/cercador-integrat/fitxa-curs.html?nomCurso=/0189057/001&codi_curso_seleccionado=24/FPOIES_23_24/714/0189057/001,Institut de l'Ebre,43155,"AV AV. COLOM,  34-42",40.814926,0.514809,977500949,e3004441@xtec.cat,,43500,2802.0,SOC,Contacteu amb l'entitat,11.0
Desenvolupament d'aplicacions amb tecnologia web,Contacteu amb l'entitat,ICD,510.0,Demandant d'ocupació no ocupat,https://serveiocupacio.gencat.cat/ca/persones/vull-formar-me/certificats-professionals/,https://sede.sepe.gob.es/es/portaltrabaja/resources/pdf/especialidades/IFCD0210.pdf,,Certificat de Professionalitat/Acreditació parcial acumulable,Presencial,Presencial,Sí,2024-12-04,https://serveiocupacio.gencat.cat/ca/persones/vull-formar-me/cercadors-formacio-especialitats/cercador-integrat/fitxa-curs.html?nomCurso=/0189693/002&codi_curso_seleccionado=24/CIFOCS_ED-C-2023/719/0189693/002,CIFO La Violeta,08019,PL Comte de Sert 25,41.41693,2.133001,932541700,cifo_violeta.soc@gencat.cat,https://serveiocupacio.gencat.cat/cifolavioleta,08035,12362.0,SOC,Contacteu amb l'entitat,12.0
Muntatge i manteniment d'instal·lacions calorífiques,Contacteu amb l'entitat,IMR,220.0,Demandant d'ocupació no ocupat,https://serveiocupacio.gencat.cat/ca/persones/vull-formar-me/certificats-professionals/,https://sede.sepe.gob.es/es/portaltrabaja/resources/pdf/especialidades/IMAR0408.pdf,,Certificat de Professionalitat/Acreditació parcial acumulable,Presencial,Presencial,Sí,2024-11-01,https://serveiocupacio.gencat.cat/ca/persones/vull-formar-me/cercadors-formacio-especialitats/cercador-integrat/fitxa-curs.html?nomCurso=/0189702/006&codi_curso_seleccionado=24/CIFOCS_ED-C-2023/719/0189702/006,CIFO Vallès,08279,"CT N-150, km 15",41.554085,2.053573,937362910,cifo_valles.soc@gencat.cat,https://serveiocupacio.gencat.cat/cifosabadell,08227,12382.0,SOC,Contacteu amb l'entitat,11.0
Formació per a l' accés a les proves del permís de conducció classe D.,Contacteu amb l'entitat,TMI,345.0,Demandant d'ocupació no ocupat,https://serveiocupacio.gencat.cat/ca/persones/vull-formar-me/certificats-professionals/,https://sede.sepe.gob.es/es/portaltrabaja/resources/pdf/especialidades/TMVI64.pdf,,Certificat d'assistència,Presencial,Presencial,Sí,2025-03-02,https://serveiocupacio.gencat.cat/ca/persones/vull-formar-me/cercadors-formacio-especialitats/cercador-integrat/fitxa-curs.html?nomCurso=/0188765/007&codi_curso_seleccionado=24/ATCC1/711/0188765/007,TRANSGRUP XXI SLU,08205,AV VIA AUGUSTA 105,41.481266,2.071325,932429090,gestio@aptibus.com,,08174,46224.0,SOC,Contacteu amb l'entitat,3.0
Atenció sociosanitària a persones dependents en institucions socials,"Atendre persones dependents en l'àmbit sociosanitari en la institució on es desenvolupi la seva actuació, aplicant les estratègies dissenyades per l'equip interdisciplinari competent i els procediments per mantenir i millorar la seva autonomia perso",SCG,370.0,Demandant d'ocupació no ocupat,https://serveiocupacio.gencat.cat/ca/persones/vull-formar-me/certificats-professionals/,https://sede.sepe.gob.es/es/portaltrabaja/resources/pdf/especialidades/SSCS0208.pdf,"Cuidador/a de minusvàlids físics, psíquics i sensorials Cuidador/a de persones dependents en institucions Gericultor/a",Certificat de Professionalitat/Acreditació parcial acumulable,Presencial,Presencial,Sí,2024-09-10,https://serveiocupacio.gencat.cat/ca/persones/vull-formar-me/cercadors-formacio-especialitats/cercador-integrat/fitxa-curs.html?nomCurso=/0188322/004&codi_curso_seleccionado=24/ATCC1/711/0188322/004,FUNDACIO PRIVADA SANT JORDI DE CATALÒNIA PER DISCAPACITATS,08214,CR ANGEL GUIMERÀ 57,41.48863,2.144212,93 580 52 27,FORMACIO@cataloniafundacio.cat,,08290,25596.0,SOC,"Atendre persones dependents en l'àmbit sociosanitari en la institució on es desenvolupi la seva actuació, aplicant les estratègies dissenyades per l'equip interdisciplinari competent i els procediments per mantenir i millorar la seva autonomia perso",9.0
Mecanització per arrencament de ferritja,Contacteu amb l'entitat,FMH,540.0,Demandant d'ocupació no ocupat,https://serveiocupacio.gencat.cat/ca/persones/vull-formar-me/certificats-professionals/,https://sede.sepe.gob.es/es/portaltrabaja/resources/pdf/especialidades/FMEH0109.pdf,,Certificat de Professionalitat/Acreditació parcial acumulable,Presencial,Presencial,Sí,2024-11-07,https://serveiocupacio.gencat.cat/ca/persones/vull-formar-me/cercadors-formacio-especialitats/cercador-integrat/fitxa-curs.html?nomCurso=/0189695/004&codi_curso_seleccionado=24/CIFOCS_ED-C-2023/719/0189695/004,CIFO Salt,17155,CR Alfons Moré 1,41.972965,2.801202,972405570,cifo_salt.soc@gencat.cat,https://serveiocupacio.gencat.cat/cifosalt,17190,12383.0,SOC,Contacteu amb l'entitat,11.0
Gestió integrada de recursos humans,"Realitzar la gestió administrativa de les activitats vinculades a l'administració de recursos humans i de la informació que en deriva en el marc d'una organització, d'acord amb els objectius marcats, les normes internes establertes i la legislació v",AGD,670.0,Demandant d'ocupació no ocupat,https://serveiocupacio.gencat.cat/ca/persones/vull-formar-me/certificats-professionals/,https://sede.sepe.gob.es/es/portaltrabaja/resources/pdf/especialidades/ADGD0208.pdf,"Tècnic/a superior de recursos humans, en general Tècnic/a mitjà/ana en relacions laborals Administratiu/iva de personal administratiu/iva del Departament de Recursos Humans. Responsable de personal en PIME Gestor/a de nòmines Tècnic/a de recursos humans",Certificat de Professionalitat/Acreditació parcial acumulable,Presencial,Presencial,Sí,2024-12-09,https://serveiocupacio.gencat.cat/ca/persones/vull-formar-me/cercadors-formacio-especialitats/cercador-integrat/fitxa-curs.html?nomCurso=/0189800/003&codi_curso_seleccionado=24/CIFOCS_ED/707/0189800/003,CIFO Tarragona,43148,CM de la Budallera s/n,41.143463,1.291791,977251566,cifo_tarragona.soc@gencat.cat,https://serveiocupacio.gencat.cat/cifotarragona,43007,12385.0,SOC,"Realitzar la gestió administrativa de les activitats vinculades a l'administració de recursos humans i de la informació que en deriva en el marc d'una organització, d'acord amb els objectius marcats, les normes internes establertes i la legislació v",12.0
CURES ESTÈTIQUES DE MANS I PEUS,"Realitzar l'embelliment i els tractaments estètics de les ungles de les mans i els peus tenint en compte les condicions necessàries per seleccionar i aplicar les diferents tècniques en condicions de qualitat, seguretat i salut, atenent les necessita",IPE,220.0,Demandant d'ocupació no ocupat,https://serveiocupacio.gencat.cat/ca/persones/vull-formar-me/certificats-professionals/,https://sede.sepe.gob.es/es/portaltrabaja/resources/pdf/especialidades/IMPP0108.pdf,Manicura Pedicur/a Especialista en la cura de peus Especialista en ungles artificials Demostrador/a de productes cosmètics per a les ungles i la pell de mans i peus,Certificat de Professionalitat/Acreditació parcial acumulable,Presencial,Presencial,Sí,2024-11-05,https://serveiocupacio.gencat.cat/ca/persones/vull-formar-me/cercadors-formacio-especialitats/cercador-integrat/fitxa-curs.html?nomCurso=/0189913/001&codi_curso_seleccionado=24/BASA%2023-24/703/0189913/001,IES VALL D'HEBRON,08019,"PP  PASSEIG VALL D'HEBRON, 95 95",41.422874,2.139381,932125004,cursos@insvallhebron.cat,,08035,3768.0,SOC,"Realitzar l'embelliment i els tractaments estètics de les ungles de les mans i els peus tenint en compte les condicions necessàries per seleccionar i aplicar les diferents tècniques en condicions de qualitat, seguretat i salut, atenent les necessita",11.0
Procediments bàsics al servei de cuina,Contacteu amb l'entitat,HTR,125.0,Demandant d'ocupació no ocupat,https://serveiocupacio.gencat.cat/ca/persones/vull-formar-me/certificats-professionals/,https://sede.sepe.gob.es/es/portaltrabaja/resources/pdf/especialidades/HOTR55.pdf,,Certificat d'assistència,Presencial,Presencial,Sí,2024-11-05,https://serveiocupacio.gencat.cat/ca/persones/vull-formar-me/cercadors-formacio-especialitats/cercador-integrat/fitxa-curs.html?nomCurso=/0188358/002&codi_curso_seleccionado=24/ATCC2/712/0188358/002,FUNDACIó CIUTADANIA MULTICULTURAL,08019,PL SANT PERE 5,41.38195,2.157005,932955012,MARTINH@MESCLADIS.ORG,,08015,20870.0,SOC,Contacteu amb l'entitat,11.0
Mecanització per arrencament de ferritja,Contacteu amb l'entitat,FMH,540.0,Demandant d'ocupació no ocupat,https://serveiocupacio.gencat.cat/ca/persones/vull-formar-me/certificats-professionals/,https://sede.sepe.gob.es/es/portaltrabaja/resources/pdf/especialidades/FMEH0109.pdf,,Certificat de Professionalitat/Acreditació parcial acumulable,Presencial,Presencial,Sí,2024-11-13,https://serveiocupacio.gencat.cat/ca/persones/vull-formar-me/cercadors-formacio-especialitats/cercador-integrat/fitxa-curs.html?nomCurso=/0189695/005&codi_curso_seleccionado=24/CIFOCS_ED-C-2023/719/0189695/005,CIFO Salt,17155,CR Alfons Moré 1,41.972965,2.801202,972405570,cifo_salt.soc@gencat.cat,https://serveiocupacio.gencat.cat/cifosalt,17190,12383.0,SOC,Contacteu amb l'entitat,11.0
Atenció sociosanitària a persones dependents en institucions socials,"Atendre persones dependents en l'àmbit sociosanitari en la institució on es desenvolupi la seva actuació, aplicant les estratègies dissenyades per l'equip interdisciplinari competent i els procediments per mantenir i millorar la seva autonomia perso",SCG,370.0,Demandant d'ocupació no ocupat,https://serveiocupacio.gencat.cat/ca/persones/vull-formar-me/certificats-professionals/,https://sede.sepe.gob.es/es/portaltrabaja/resources/pdf/especialidades/SSCS0208.pdf,"Cuidador/a de minusvàlids físics, psíquics i sensorials Cuidador/a de persones dependents en institucions Gericultor/a",Certificat de Professionalitat/Acreditació parcial acumulable,Presencial,Presencial,Sí,2024-11-04,https://serveiocupacio.gencat.cat/ca/persones/vull-formar-me/cercadors-formacio-especialitats/cercador-integrat/fitxa-curs.html?nomCurso=/0188422/001&codi_curso_seleccionado=24/ATCC1/711/0188422/001,"SANT ANDREU SALUT, FUNDACIÓ PRIVADA",08113,PL HOSPITAL S/N,41.726776,1.829941,938743312,FUNDACIO@SANTANDREUSALUT.CAT,,08241,45635.0,SOC,"Atendre persones dependents en l'àmbit sociosanitari en la institució on es desenvolupi la seva actuació, aplicant les estratègies dissenyades per l'equip interdisciplinari competent i els procediments per mantenir i millorar la seva autonomia perso",11.0
Operacions auxiliars de serveis administratius i generals,Contacteu amb l'entitat,AGG,390.0,Demandant d'ocupació no ocupat,https://serveiocupacio.gencat.cat/ca/persones/vull-formar-me/certificats-professionals/,https://sede.sepe.gob.es/es/portaltrabaja/resources/pdf/especialidades/ADGG0408.pdf,,Certificat de Professionalitat/Acreditació parcial acumulable,Presencial,Presencial,Sí,2024-09-02,https://serveiocupacio.gencat.cat/ca/persones/vull-formar-me/cercadors-formacio-especialitats/cercador-integrat/fitxa-curs.html?nomCurso=/0184138/001&codi_curso_seleccionado=23/FOAP/680/0184138/001,FUNDACIó IMFE MAS CARANDELL,43123,"CR TEROL 1 (BARRI GAUDI, ) Terol",41.161957,1.095019,977010850,correu@mascarandell.cat,,43206,4085.0,SOC,Contacteu amb l'entitat,9.0
Perruqueria,Contacteu amb l'entitat,IPQ,590.0,Demandant d'ocupació no ocupat,https://serveiocupacio.gencat.cat/ca/persones/vull-formar-me/certificats-professionals/,https://sede.sepe.gob.es/es/portaltrabaja/resources/pdf/especialidades/IMPQ0208.pdf,,Certificat de Professionalitat/Acreditació parcial acumulable,Presencial,Presencial,Sí,2024-11-11,https://serveiocupacio.gencat.cat/ca/persones/vull-formar-me/cercadors-formacio-especialitats/cercador-integrat/fitxa-curs.html?nomCurso=/0189001/004&codi_curso_seleccionado=24/ATCC2/712/0189001/004,"C & C CASANOVA, S.A.",08015,CR FRANCESC LAYRET 63-65,41.380688,2.155641,933841313,ASESORA@CC-LLONGUERAS.COM,,08015,2973.0,SOC,Contacteu amb l'entitat,11.0
"Vigilància, seguretat privada i protecció de persones",Contacteu amb l'entitat,SMD,290.0,Demandant d'ocupació no ocupat,https://serveiocupacio.gencat.cat/ca/persones/vull-formar-me/certificats-professionals/,https://sede.sepe.gob.es/es/portaltrabaja/resources/pdf/especialidades/SEAD0112.pdf,,Certificat de Professionalitat/Acreditació parcial acumulable,Presencial,Presencial,Sí,2024-10-14,https://serveiocupacio.gencat.cat/ca/persones/vull-formar-me/cercadors-formacio-especialitats/cercador-integrat/fitxa-curs.html?nomCurso=/0188336/001&codi_curso_seleccionado=24/ATCC1/711/0188336/001,PROSEGUR SERVICIOS  DE EFECTIVO ESPAÑA S.L. SOCIEDAD UNIPERSONAL,08101,AV GRAN VIA 175-177 POL. GRAN VIA SUR 175-177,41.349693,2.117256,934029787,gonzalo.garcia-hernandez@prosegur.com,https://www.prosegur.es/,08908,45134.0,SOC,Contacteu amb l'entitat,10.0
GESTIÓ I  CONTROL DE PLANTA QUÍMICA,Contacteu amb l'entitat,QUE,760.0,Demandant d'ocupació no ocupat,https://serveiocupacio.gencat.cat/ca/persones/vull-formar-me/certificats-professionals/,https://sede.sepe.gob.es/es/portaltrabaja/resources/pdf/especialidades/QUIB0108.pdf,,Certificat de Professionalitat/Acreditació parcial acumulable,Presencial,Presencial,Sí,2024-12-12,https://serveiocupacio.gencat.cat/ca/persones/vull-formar-me/cercadors-formacio-especialitats/cercador-integrat/fitxa-curs.html?nomCurso=/0189800/001&codi_curso_seleccionado=24/CIFOCS_ED/707/0189800/001,CIFO Tarragona,43148,CM de la Budallera s/n,41.143463,1.291791,977251566,cifo_tarragona.soc@gencat.cat,https://serveiocupacio.gencat.cat/cifotarragona,43007,12385.0,SOC,Contacteu amb l'entitat,12.0
Serveis bàsics de barres i sala a la restauració,Contacteu amb l'entitat,HTR,20.0,Demandant d'ocupació no ocupat,https://serveiocupacio.gencat.cat/ca/persones/vull-formar-me/certificats-professionals/,https://sede.sepe.gob.es/es/portaltrabaja/resources/pdf/especialidades/HOTR26.pdf,,Certificat d'assistència,Presencial,Presencial,Sí,2025-02-17,https://serveiocupacio.gencat.cat/ca/persones/vull-formar-me/cercadors-formacio-especialitats/cercador-integrat/fitxa-curs.html?nomCurso=/0189552/016&codi_curso_seleccionado=24/ATCC2/712/0189552/016,CONSULTORIA INCORPORA,08089,CR Sant Isidre 66,41.281376,1.981161,938029983,raimon@consultoriaincorpora.com,,08860,46233.0,SOC,Contacteu amb l'entitat,2.0
Procediments bàsics al servei de sala,Contacteu amb l'entitat,HTR,125.0,Demandant d'ocupació no ocupat,https://serveiocupacio.gencat.cat/ca/persones/vull-formar-me/certificats-professionals/,https://sede.sepe.gob.es/es/portaltrabaja/resources/pdf/especialidades/HOTR56.pdf,,Certificat d'assistència,Presencial,Presencial,Sí,2025-03-10,https://serveiocupacio.gencat.cat/ca/persones/vull-formar-me/cercadors-formacio-especialitats/cercador-integrat/fitxa-curs.html?nomCurso=/0189552/020&codi_curso_seleccionado=24/ATCC2/712/0189552/020,CONSULTORIA INCORPORA,08089,CR Sant Isidre 66,41.281376,1.981161,938029983,raimon@consultoriaincorpora.com,,08860,46233.0,SOC,Contacteu amb l'entitat,3.0
