nomcurs,desccurscat,codiarea,duradacurs,personesdest,requisits,temari,sortides,titulacio,codimodalitat,nommodalitat,financiacio,datainici,preinscripcio,nomcentre,codimunicipi,adrecacentre,latitud,longitud,telefon,correu,web,codipostal,codicentre,departament,desccurses,mes
Noves tecnologies interactives a l'aula,Contacteu amb l'entitat,SCE,25.0,Demandant d'ocupació no ocupat,https://serveiocupacio.gencat.cat/ca/persones/vull-formar-me/certificats-professionals/,https://sede.sepe.gob.es/es/portaltrabaja/resources/pdf/especialidades/SSCE24.pdf,,Certificat d'assistència,Presencial,Presencial,Sí,2024-12-11,https://serveiocupacio.gencat.cat/ca/persones/vull-formar-me/cercadors-formacio-especialitats/cercador-integrat/fitxa-curs.html?nomCurso=/0187343/001&codi_curso_seleccionado=24/CIFOFSE/702/0187343/001,CIFO Tarragona,43148,CM de la Budallera s/n,41.143463,1.291791,977251566,cifo_tarragona.soc@gencat.cat,https://serveiocupacio.gencat.cat/cifotarragona,43007,12385.0,SOC,Contacteu amb l'entitat,12.0
Servei de begudes a barra i sala,Contacteu amb l'entitat,HTR,12.0,Demandant d'ocupació no ocupat,https://serveiocupacio.gencat.cat/ca/persones/vull-formar-me/certificats-professionals/,https://sede.sepe.gob.es/es/portaltrabaja/resources/pdf/especialidades/HOTR17.pdf,,Certificat d'assistència,Presencial,Presencial,Sí,2025-07-07,https://serveiocupacio.gencat.cat/ca/persones/vull-formar-me/cercadors-formacio-especialitats/cercador-integrat/fitxa-curs.html?nomCurso=/0189552/031&codi_curso_seleccionado=24/ATCC2/712/0189552/031,CONSULTORIA INCORPORA,08089,CR Sant Isidre 66,41.281376,1.981161,938029983,raimon@consultoriaincorpora.com,,08860,46233.0,SOC,Contacteu amb l'entitat,7.0
Atenció al client a la restauració,Contacteu amb l'entitat,HTR,15.0,Demandant d'ocupació no ocupat,https://serveiocupacio.gencat.cat/ca/persones/vull-formar-me/certificats-professionals/,https://sede.sepe.gob.es/es/portaltrabaja/resources/pdf/especialidades/HOTR37.pdf,,Certificat d'assistència,Presencial,Presencial,Sí,2025-02-11,https://serveiocupacio.gencat.cat/ca/persones/vull-formar-me/cercadors-formacio-especialitats/cercador-integrat/fitxa-curs.html?nomCurso=/0189552/014&codi_curso_seleccionado=24/ATCC2/712/0189552/014,CONSULTORIA INCORPORA,08089,CR Sant Isidre 66,41.281376,1.981161,938029983,raimon@consultoriaincorpora.com,,08860,46233.0,SOC,Contacteu amb l'entitat,2.0
"Vigilància, seguretat privada i protecció de persones",Contacteu amb l'entitat,SMD,290.0,Demandant d'ocupació no ocupat,https://serveiocupacio.gencat.cat/ca/persones/vull-formar-me/certificats-professionals/,https://sede.sepe.gob.es/es/portaltrabaja/resources/pdf/especialidades/SEAD0112.pdf,,Certificat de Professionalitat/Acreditació parcial acumulable,Presencial,Presencial,Sí,2024-11-11,https://serveiocupacio.gencat.cat/ca/persones/vull-formar-me/cercadors-formacio-especialitats/cercador-integrat/fitxa-curs.html?nomCurso=/0189016/004&codi_curso_seleccionado=24/ATCC2/712/0189016/004,"CAMPUS SEGURIDAD, S.L.",08063,"CR Carretera N-II A, km-560          1",41.356808,2.104509,628476159,info@campuseguridad.com,https://campuseguridad.com/,08907,45108.0,SOC,Contacteu amb l'entitat,11.0
Organització del transport i la distribució,Contacteu amb l'entitat,CML,340.0,Demandant d'ocupació no ocupat,https://serveiocupacio.gencat.cat/ca/persones/vull-formar-me/certificats-professionals/,https://sede.sepe.gob.es/es/portaltrabaja/resources/pdf/especialidades/COML0209.pdf,,Certificat de Professionalitat/Acreditació parcial acumulable,Presencial,Presencial,Sí,2024-10-01,https://serveiocupacio.gencat.cat/ca/persones/vull-formar-me/cercadors-formacio-especialitats/cercador-integrat/fitxa-curs.html?nomCurso=/0189608/001&codi_curso_seleccionado=24/FPOIES_23_24/714/0189608/001,INSTITUT SALVADOR SUNYER I AIMERIC,17155,CR MIQUEL MARTí I POL S/N,41.968258,2.782514,972234975,B7008407@XTEC.CAT,https://agora.xtec.cat/inssalvadorsunyer/,17190,46250.0,SOC,Contacteu amb l'entitat,10.0
Procediments bàsics al servei de cuina,Contacteu amb l'entitat,HTR,125.0,Demandant d'ocupació no ocupat,https://serveiocupacio.gencat.cat/ca/persones/vull-formar-me/certificats-professionals/,https://sede.sepe.gob.es/es/portaltrabaja/resources/pdf/especialidades/HOTR55.pdf,,Certificat d'assistència,Presencial,Presencial,Sí,2025-07-01,https://serveiocupacio.gencat.cat/ca/persones/vull-formar-me/cercadors-formacio-especialitats/cercador-integrat/fitxa-curs.html?nomCurso=/0189552/009&codi_curso_seleccionado=24/ATCC2/712/0189552/009,CONSULTORIA INCORPORA,08089,CR Sant Isidre 66,41.281376,1.981161,938029983,raimon@consultoriaincorpora.com,,08860,46233.0,SOC,Contacteu amb l'entitat,7.0
Bones pràctiques ambientals a l'hostaleria,Contacteu amb l'entitat,HTR,6.0,Demandant d'ocupació no ocupat,https://serveiocupacio.gencat.cat/ca/persones/vull-formar-me/certificats-professionals/,https://sede.sepe.gob.es/es/portaltrabaja/resources/pdf/especialidades/HOTR38.pdf,,Certificat d'assistència,Presencial,Presencial,Sí,2025-02-14,https://serveiocupacio.gencat.cat/ca/persones/vull-formar-me/cercadors-formacio-especialitats/cercador-integrat/fitxa-curs.html?nomCurso=/0189552/015&codi_curso_seleccionado=24/ATCC2/712/0189552/015,CONSULTORIA INCORPORA,08089,CR Sant Isidre 66,41.281376,1.981161,938029983,raimon@consultoriaincorpora.com,,08860,46233.0,SOC,Contacteu amb l'entitat,2.0
Serveis bàsics de barres i sala a la restauració,Contacteu amb l'entitat,HTR,20.0,Demandant d'ocupació no ocupat,https://serveiocupacio.gencat.cat/ca/persones/vull-formar-me/certificats-professionals/,https://sede.sepe.gob.es/es/portaltrabaja/resources/pdf/especialidades/HOTR26.pdf,,Certificat d'assistència,Presencial,Presencial,Sí,2025-07-01,https://serveiocupacio.gencat.cat/ca/persones/vull-formar-me/cercadors-formacio-especialitats/cercador-integrat/fitxa-curs.html?nomCurso=/0189552/030&codi_curso_seleccionado=24/ATCC2/712/0189552/030,CONSULTORIA INCORPORA,08089,CR Sant Isidre 66,41.281376,1.981161,938029983,raimon@consultoriaincorpora.com,,08860,46233.0,SOC,Contacteu amb l'entitat,7.0
Manteniment de vehicles híbrids i elèctrics,Contacteu amb l'entitat,TMG,90.0,Demandant d'ocupació no ocupat,https://serveiocupacio.gencat.cat/ca/persones/vull-formar-me/certificats-professionals/,https://sede.sepe.gob.es/es/portaltrabaja/resources/pdf/especialidades/TMVG02.pdf,,Certificat d'assistència,Presencial,Presencial,Sí,2024-11-05,https://serveiocupacio.gencat.cat/ca/persones/vull-formar-me/cercadors-formacio-especialitats/cercador-integrat/fitxa-curs.html?nomCurso=/0184189/025&codi_curso_seleccionado=23/FOAP/680/0184189/025,"MERIN'S ESCOLA DE FORMACIÓ PROFESSIONAL, SL",08019,CR Santa Matilde 20-24,41.429024,2.171033,934073113,info@merinsformacio.com,http://www.merinsformacio.com,08031,1793.0,SOC,Contacteu amb l'entitat,11.0
Operacions auxiliars de muntatge i manteniment d'equips elèctrics i electrònics,Contacteu amb l'entitat,EEQ,190.0,Demandant d'ocupació no ocupat,https://serveiocupacio.gencat.cat/ca/persones/vull-formar-me/certificats-professionals/,https://sede.sepe.gob.es/es/portaltrabaja/resources/pdf/especialidades/ELEQ0111.pdf,,Certificat de Professionalitat/Acreditació parcial acumulable,Presencial,Presencial,Sí,2024-12-20,https://serveiocupacio.gencat.cat/ca/persones/vull-formar-me/cercadors-formacio-especialitats/cercador-integrat/fitxa-curs.html?nomCurso=/0189702/015&codi_curso_seleccionado=24/CIFOCS_ED-C-2023/719/0189702/015,CIFO Vallès,08279,"CT N-150, km 15",41.63159,2.29423,937362910,cifo_valles.soc@gencat.cat,https://serveiocupacio.gencat.cat/cifosabadell,08520,12382.0,SOC,Contacteu amb l'entitat,12.0
Animació físic-esportiva i recreativa,Contacteu amb l'entitat,AEA,470.0,Demandant d'ocupació no ocupat,https://serveiocupacio.gencat.cat/ca/persones/vull-formar-me/certificats-professionals/,https://sede.sepe.gob.es/es/portaltrabaja/resources/pdf/especialidades/AFDA0211.pdf,,Certificat de Professionalitat/Acreditació parcial acumulable,Presencial,Presencial,Sí,2024-10-07,https://serveiocupacio.gencat.cat/ca/persones/vull-formar-me/cercadors-formacio-especialitats/cercador-integrat/fitxa-curs.html?nomCurso=/0189720/001&codi_curso_seleccionado=24/FPOIES_23_24/714/0189720/001,IES LA BASTIDA,08245,CR SANTA EULàLIA S/N,41.45387,2.21014,933924261,ocupacionals@institutlabastida.org,,08921,17867.0,SOC,Contacteu amb l'entitat,10.0
Disseny de productes de fabricació mecànica,Contacteu amb l'entitat,FMH,600.0,Demandant d'ocupació no ocupat,https://serveiocupacio.gencat.cat/ca/persones/vull-formar-me/certificats-professionals/,https://sede.sepe.gob.es/es/portaltrabaja/resources/pdf/especialidades/FMEE0308.pdf,,Certificat de Professionalitat/Acreditació parcial acumulable,Presencial,Presencial,Sí,2024-11-04,https://serveiocupacio.gencat.cat/ca/persones/vull-formar-me/cercadors-formacio-especialitats/cercador-integrat/fitxa-curs.html?nomCurso=/0189756/007&codi_curso_seleccionado=24/CIFOCS_ED-C-2023/719/0189756/007,CIFO Sant Feliu,08211,CR L¿Hospitalet 3,41.386196,2.041162,936857790,cifo_santfeliu.soc@gencat.cat,https://serveiocupacio.gencat.cat/cifosantfeliu,08980,12387.0,SOC,Contacteu amb l'entitat,11.0
"ACTIVITATS AUXILIARS EN VIVERS, JARDINS I CENTRES DE JARDINERIA.","Executar operacions auxiliars per a la implantació i manteniment de jardins, parcs i zones verdes, així com per a la producció i manteniment de plantes en vivers i centres de jardineria, seguint instruccions de superiors o pla de treball i complint",ARJ,250.0,Demandant d'ocupació no ocupat,https://serveiocupacio.gencat.cat/ca/persones/vull-formar-me/certificats-professionals/,https://sede.sepe.gob.es/es/portaltrabaja/resources/pdf/especialidades/AGAO0108.pdf,"Peó agrícola, jardineria Peó de viver Peó de centres de jardineria",Certificat de Professionalitat/Acreditació parcial acumulable,Presencial,Presencial,Sí,2024-11-25,https://serveiocupacio.gencat.cat/ca/persones/vull-formar-me/cercadors-formacio-especialitats/cercador-integrat/fitxa-curs.html?nomCurso=/0189750/004&codi_curso_seleccionado=24/FPOIES_23_24/714/0189750/004,IES MOLLERUSSA,25137,"CT Torregrossa, km 1,9 s/n",0.0,0.0,973600359,areig@xtec.cat,,25230,16560.0,SOC,"Executar operacions auxiliars per a la implantació i manteniment de jardins, parcs i zones verdes, així com per a la producció i manteniment de plantes en vivers i centres de jardineria, seguint instruccions de superiors o pla de treball i complint",11.0
Encunyació,Contacteu amb l'entitat,AFT,250.0,Demandant d'ocupació no ocupat,https://serveiocupacio.gencat.cat/ca/persones/vull-formar-me/certificats-professionals/,https://sede.sepe.gob.es/es/portaltrabaja/resources/pdf/especialidades/ARGT0109.pdf,,Certificat de Professionalitat/Acreditació parcial acumulable,Presencial,Presencial,Sí,2025-01-21,https://serveiocupacio.gencat.cat/ca/persones/vull-formar-me/cercadors-formacio-especialitats/cercador-integrat/fitxa-curs.html?nomCurso=/0189721/004&codi_curso_seleccionado=24/CIFOCS_ED/707/0189721/004,CIFO L'Hospitalet,08101,CT del Mig 24,41.359455,2.114514,932603120,cifo_hospitalet.soc@gencat.cat,https://serveiocupacio.gencat.cat/cifohospitalet,08907,12386.0,SOC,Contacteu amb l'entitat,1.0
Socorrisme en espais aquàtics naturals,Contacteu amb l'entitat,AEP,340.0,Demandant d'ocupació no ocupat,https://serveiocupacio.gencat.cat/ca/persones/vull-formar-me/certificats-professionals/,https://sede.sepe.gob.es/es/portaltrabaja/resources/pdf/especialidades/AFDP0209.pdf,,Certificat de Professionalitat/Acreditació parcial acumulable,Presencial,Presencial,Sí,2025-03-17,https://serveiocupacio.gencat.cat/ca/persones/vull-formar-me/cercadors-formacio-especialitats/cercador-integrat/fitxa-curs.html?nomCurso=/0187960/010&codi_curso_seleccionado=24/ATCC2/712/0187960/010,"INNOVACION SEGURIDAD EMERGENCIAS INTITUTO, SL",08015,CR RECTOR  91-95,0.0,0.0,934644878,formacion@iseinstitut.com,,08912,36878.0,SOC,Contacteu amb l'entitat,3.0
Socorrisme en instal·lacions aquàtiques,Contacteu amb l'entitat,AEP,290.0,Demandant d'ocupació no ocupat,https://serveiocupacio.gencat.cat/ca/persones/vull-formar-me/certificats-professionals/,https://sede.sepe.gob.es/es/portaltrabaja/resources/pdf/especialidades/AFDP0109.pdf,,Certificat de Professionalitat/Acreditació parcial acumulable,Presencial,Presencial,Sí,2024-10-30,https://serveiocupacio.gencat.cat/ca/persones/vull-formar-me/cercadors-formacio-especialitats/cercador-integrat/fitxa-curs.html?nomCurso=/0188036/013&codi_curso_seleccionado=24/ATCC2/712/0188036/013,BLUE ALFA SAFETY S.L.,43100,CT SANTES CREUS  8,41.175327,1.274066,657369414,administracion@bluesafety.es,,43151,40542.0,SOC,Contacteu amb l'entitat,10.0
Atenció sanitària a múltiples víctimes i en catàstrofes,Contacteu amb l'entitat,SAT,340.0,Demandant d'ocupació no ocupat,https://serveiocupacio.gencat.cat/ca/persones/vull-formar-me/certificats-professionals/,https://sede.sepe.gob.es/es/portaltrabaja/resources/pdf/especialidades/SANT0108.pdf,,Certificat de Professionalitat/Acreditació parcial acumulable,Presencial,Presencial,Sí,2024-11-18,https://serveiocupacio.gencat.cat/ca/persones/vull-formar-me/cercadors-formacio-especialitats/cercador-integrat/fitxa-curs.html?nomCurso=/0189057/004&codi_curso_seleccionado=24/FPOIES_23_24/714/0189057/004,Institut de l'Ebre,43155,"AV AV. COLOM,  34-42",40.814926,0.514809,977500949,e3004441@xtec.cat,,43500,2802.0,SOC,Contacteu amb l'entitat,11.0
OPERACIONS BÀSIQUES DE RESTAURANT I BAR,"Assistir en el servei i preparar i presentar begudes senzilles i menjars ràpids, executant i aplicant operacions, tècniques i normes bàsiques de manipulació, preparació i conservació d'aliments i begudes. Executar operacions bàsiques d'aprovisioname",HTR,210.0,Demandant d'ocupació no ocupat,https://serveiocupacio.gencat.cat/ca/persones/vull-formar-me/certificats-professionals/,https://sede.sepe.gob.es/es/portaltrabaja/resources/pdf/especialidades/HOTR0208.pdf,Ajudant/a de cambrer/a Ajudant/a de bar Ajudant/a de rebost Auxiliar de col·lectivitats Empleat/ada de petit establiment de restauració,Certificat de Professionalitat/Acreditació parcial acumulable,Presencial,Presencial,Sí,2024-10-14,https://serveiocupacio.gencat.cat/ca/persones/vull-formar-me/cercadors-formacio-especialitats/cercador-integrat/fitxa-curs.html?nomCurso=/0189746/001&codi_curso_seleccionado=24/FPOIES_23_24/714/0189746/001,SECCIó DE FORMACIó PROFESSIONAL-ESCOLA D,25121,"CR BANYS, S/N. s/n",0.0,0.0,973647242,c5006148@xtec.cat,http://www.iesostalaria.com,25540,3678.0,SOC,"Assistir en el servei i preparar i presentar begudes senzilles i menjars ràpids, executant i aplicant operacions, tècniques i normes bàsiques de manipulació, preparació i conservació d'aliments i begudes. Executar operacions bàsiques d'aprovisioname",10.0
Muntatge i manteniment d'instal·lacions elèctriques de baixa tensió,Contacteu amb l'entitat,EEE,840.0,Demandant d'ocupació no ocupat,https://serveiocupacio.gencat.cat/ca/persones/vull-formar-me/certificats-professionals/,https://sede.sepe.gob.es/es/portaltrabaja/resources/pdf/especialidades/ELEE0109.pdf,,Certificat de Professionalitat/Acreditació parcial acumulable,Presencial,Presencial,Sí,2024-11-08,https://serveiocupacio.gencat.cat/ca/persones/vull-formar-me/cercadors-formacio-especialitats/cercador-integrat/fitxa-curs.html?nomCurso=/0189754/002&codi_curso_seleccionado=24/CIFOCS_ED/707/0189754/002,CIFO Sant Feliu,08211,CR L¿Hospitalet 3,41.386196,2.041162,936857790,cifo_santfeliu.soc@gencat.cat,https://serveiocupacio.gencat.cat/cifosantfeliu,08980,12387.0,SOC,Contacteu amb l'entitat,11.0
Impressió digital,Interpretar i gestionar la informació per al procés gràfic i imprimir per mitjà de les tecnologies digitals per assolir la productivitat i la qualitat dels productes en les condicions de seguretat establertes. Interpretar i gestionar la informació d,AFI,320.0,Demandant d'ocupació no ocupat,https://serveiocupacio.gencat.cat/ca/persones/vull-formar-me/certificats-professionals/,https://sede.sepe.gob.es/es/portaltrabaja/resources/pdf/especialidades/ARGI0209.pdf,Preparador/a de premèdia Impressor/a digital Operador/a sistemes digitals Tècnic/a en impressió digital,Certificat de Professionalitat/Acreditació parcial acumulable,Presencial,Presencial,Sí,2024-10-21,https://serveiocupacio.gencat.cat/ca/persones/vull-formar-me/cercadors-formacio-especialitats/cercador-integrat/fitxa-curs.html?nomCurso=/0189392/001&codi_curso_seleccionado=24/FPOIES_23_24/714/0189392/001,INSTITUT DE FORMACIó PROFESSIONAL ANTONI ALGUERó,08221,CR PARLAMENT CATALà 1,0.0,0.0,931939581,a8077447@xtec.cat,https://agora.xtec.cat/ifp-alguero/,08960,46148.0,SOC,Interpretar i gestionar la informació per al procés gràfic i imprimir per mitjà de les tecnologies digitals per assolir la productivitat i la qualitat dels productes en les condicions de seguretat establertes. Interpretar i gestionar la informació d,10.0
Fabricació i muntatge d'instal·lacions de canonada industrial,"Realitzar operacions d'elaboració, acoblament i muntatge de canonades, accessoris i elements incorporats, així com operacions bàsiques d'unió, seguint els procediments establerts, interpretar plànols i documentació tècnica, atenent i respectant en t",FMC,450.0,Demandant d'ocupació no ocupat,https://serveiocupacio.gencat.cat/ca/persones/vull-formar-me/certificats-professionals/,https://sede.sepe.gob.es/es/portaltrabaja/resources/pdf/especialidades/FMEC0108.pdf,Calderer/a tuber/a Tuber/a industrial Tuber/a naval,Certificat de Professionalitat/Acreditació parcial acumulable,Presencial,Presencial,Sí,2024-11-18,https://serveiocupacio.gencat.cat/ca/persones/vull-formar-me/cercadors-formacio-especialitats/cercador-integrat/fitxa-curs.html?nomCurso=/0189796/009&codi_curso_seleccionado=24/CIFOCS_ED-C-2023/719/0189796/009,CIFO Tarragona,43148,CM de la Budallera s/n,41.143463,1.291791,977251566,cifo_tarragona.soc@gencat.cat,https://serveiocupacio.gencat.cat/cifotarragona,43007,12385.0,SOC,"Realitzar operacions d'elaboració, acoblament i muntatge de canonades, accessoris i elements incorporats, així com operacions bàsiques d'unió, seguint els procediments establerts, interpretar plànols i documentació tècnica, atenent i respectant en t",11.0
Atenció sociosanitària a persones dependents en institucions socials,"Atendre persones dependents en l'àmbit sociosanitari en la institució on es desenvolupi la seva actuació, aplicant les estratègies dissenyades per l'equip interdisciplinari competent i els procediments per mantenir i millorar la seva autonomia perso",SCG,370.0,Demandant d'ocupació no ocupat,https://serveiocupacio.gencat.cat/ca/persones/vull-formar-me/certificats-professionals/,https://sede.sepe.gob.es/es/portaltrabaja/resources/pdf/especialidades/SSCS0208.pdf,"Cuidador/a de minusvàlids físics, psíquics i sensorials Cuidador/a de persones dependents en institucions Gericultor/a",Certificat de Professionalitat/Acreditació parcial acumulable,Presencial,Presencial,Sí,2024-09-02,https://serveiocupacio.gencat.cat/ca/persones/vull-formar-me/cercadors-formacio-especialitats/cercador-integrat/fitxa-curs.html?nomCurso=/0184618/013&codi_curso_seleccionado=23/FOAP/680/0184618/013,SH CONCEPT FORMACIO SL,17164,"PO MAS GARRIGA, CENTRE AQUA 20",41.884987,2.517878,638233922,albert@shcformacio.com,http://www.shconceptformacio.cat,17403,40675.0,SOC,"Atendre persones dependents en l'àmbit sociosanitari en la institució on es desenvolupi la seva actuació, aplicant les estratègies dissenyades per l'equip interdisciplinari competent i els procediments per mantenir i millorar la seva autonomia perso",9.0
Bones pràctiques ambientals a l'hostaleria,Contacteu amb l'entitat,HTR,6.0,Demandant d'ocupació no ocupat,https://serveiocupacio.gencat.cat/ca/persones/vull-formar-me/certificats-professionals/,https://sede.sepe.gob.es/es/portaltrabaja/resources/pdf/especialidades/HOTR38.pdf,,Certificat d'assistència,Presencial,Presencial,Sí,2025-04-25,https://serveiocupacio.gencat.cat/ca/persones/vull-formar-me/cercadors-formacio-especialitats/cercador-integrat/fitxa-curs.html?nomCurso=/0189552/022&codi_curso_seleccionado=24/ATCC2/712/0189552/022,CONSULTORIA INCORPORA,08089,CR Sant Isidre 66,41.281376,1.981161,938029983,raimon@consultoriaincorpora.com,,08860,46233.0,SOC,Contacteu amb l'entitat,4.0
Disseny de caldereria i estructures metàl·liques,Contacteu amb l'entitat,FMC,280.0,Demandant d'ocupació no ocupat,https://serveiocupacio.gencat.cat/ca/persones/vull-formar-me/certificats-professionals/,https://sede.sepe.gob.es/es/portaltrabaja/resources/pdf/especialidades/FMEC0208.pdf,,Certificat de Professionalitat/Acreditació parcial acumulable,Presencial,Presencial,Sí,2024-12-02,https://serveiocupacio.gencat.cat/ca/persones/vull-formar-me/cercadors-formacio-especialitats/cercador-integrat/fitxa-curs.html?nomCurso=/0189702/001&codi_curso_seleccionado=24/CIFOCS_ED-C-2023/719/0189702/001,CIFO Vallès,08279,"CT N-150, km 15",41.554085,2.053573,937362910,cifo_valles.soc@gencat.cat,https://serveiocupacio.gencat.cat/cifosabadell,08227,12382.0,SOC,Contacteu amb l'entitat,12.0
Socorrisme en instal·lacions aquàtiques,Contacteu amb l'entitat,AEP,290.0,Demandant d'ocupació no ocupat,https://serveiocupacio.gencat.cat/ca/persones/vull-formar-me/certificats-professionals/,https://sede.sepe.gob.es/es/portaltrabaja/resources/pdf/especialidades/AFDP0109.pdf,,Certificat de Professionalitat/Acreditació parcial acumulable,Presencial,Presencial,Sí,2024-11-25,https://serveiocupacio.gencat.cat/ca/persones/vull-formar-me/cercadors-formacio-especialitats/cercador-integrat/fitxa-curs.html?nomCurso=/0189750/001&codi_curso_seleccionado=24/FPOIES_23_24/714/0189750/001,IES MOLLERUSSA,25137,"CT Torregrossa, km 1,9 s/n",0.0,0.0,973600359,areig@xtec.cat,,25230,16560.0,SOC,Contacteu amb l'entitat,11.0
Disseny de productes gràfics,Contacteu amb l'entitat,AFG,560.0,Demandant d'ocupació no ocupat,https://serveiocupacio.gencat.cat/ca/persones/vull-formar-me/certificats-professionals/,https://sede.sepe.gob.es/es/portaltrabaja/resources/pdf/especialidades/ARGG0110.pdf,,Certificat de Professionalitat/Acreditació parcial acumulable,Presencial,Presencial,Sí,2024-11-08,https://serveiocupacio.gencat.cat/ca/persones/vull-formar-me/cercadors-formacio-especialitats/cercador-integrat/fitxa-curs.html?nomCurso=/0189721/005&codi_curso_seleccionado=24/CIFOCS_ED/707/0189721/005,CIFO L'Hospitalet,08101,CT del Mig 24,41.359455,2.114514,932603120,cifo_hospitalet.soc@gencat.cat,https://serveiocupacio.gencat.cat/cifohospitalet,08907,12386.0,SOC,Contacteu amb l'entitat,11.0
"Programa de qualificació inicial accelerada amb sensibilització i educació viària, tacògraf digital i atenció i informació als viatgers (Viatgers)",Contacteu amb l'entitat,TMI,140.0,Demandant d'ocupació no ocupat,https://serveiocupacio.gencat.cat/ca/persones/vull-formar-me/certificats-professionals/,https://sede.sepe.gob.es/es/portaltrabaja/resources/pdf/especialidades/TMVI58.pdf,,Certificat d'assistència,Presencial,Presencial,Sí,2025-01-20,https://serveiocupacio.gencat.cat/ca/persones/vull-formar-me/cercadors-formacio-especialitats/cercador-integrat/fitxa-curs.html?nomCurso=/0188089/014&codi_curso_seleccionado=24/ATCC1/711/0188089/014,TRANSGRUP XXI SLU,08205,AV VIA AUGUSTA 105,41.528122,2.430535,932429090,gestio@aptibus.com,,08302,46224.0,SOC,Contacteu amb l'entitat,1.0
Muntatge i manteniment d'instal·lacions de geotèrmia i energia solar aplicades a la climatització,Contacteu amb l'entitat,IMR,50.0,Demandant d'ocupació no ocupat,https://serveiocupacio.gencat.cat/ca/persones/vull-formar-me/certificats-professionals/,https://sede.sepe.gob.es/es/portaltrabaja/resources/pdf/especialidades/IMAR13.pdf,,Certificat d'assistència,Presencial,Presencial,Sí,2024-11-20,https://serveiocupacio.gencat.cat/ca/persones/vull-formar-me/cercadors-formacio-especialitats/cercador-integrat/fitxa-curs.html?nomCurso=/0188864/004&codi_curso_seleccionado=24/ATCC1/711/0188864/004,FUNDACIO ENGRUNES,08125,CR Roca plana 14-16,41.3492,2.083725,935829999,apalma@engrunes.org,,08940,4065.0,SOC,Contacteu amb l'entitat,11.0
Activitats auxiliars de magatzem,Contacteu amb l'entitat,CML,170.0,Demandant d'ocupació no ocupat,https://serveiocupacio.gencat.cat/ca/persones/vull-formar-me/certificats-professionals/,https://sede.sepe.gob.es/es/portaltrabaja/resources/pdf/especialidades/COML0110.pdf,,Certificat de Professionalitat/Acreditació parcial acumulable,Presencial,Presencial,Sí,2024-10-15,https://serveiocupacio.gencat.cat/ca/persones/vull-formar-me/cercadors-formacio-especialitats/cercador-integrat/fitxa-curs.html?nomCurso=/0184326/067&codi_curso_seleccionado=23/FOAP/680/0184326/067,INSTITUT CATALA ENSENYAMENT INDUSTRIAL S.L.,08101,CR SANTA EULALIA 174,41.3654,2.122147,0934227088,y.roch@icei-formacion.com,http://www.instcat.com,08902,1882.0,SOC,Contacteu amb l'entitat,10.0
Formació per a l' accés a les proves del permís de conducció classe D.,Contacteu amb l'entitat,TMI,345.0,Demandant d'ocupació no ocupat,https://serveiocupacio.gencat.cat/ca/persones/vull-formar-me/certificats-professionals/,https://sede.sepe.gob.es/es/portaltrabaja/resources/pdf/especialidades/TMVI64.pdf,,Certificat d'assistència,Presencial,Presencial,Sí,2025-04-22,https://serveiocupacio.gencat.cat/ca/persones/vull-formar-me/cercadors-formacio-especialitats/cercador-integrat/fitxa-curs.html?nomCurso=/0188765/011&codi_curso_seleccionado=24/ATCC1/711/0188765/011,TRANSGRUP XXI SLU,08205,AV VIA AUGUSTA 105,0.0,0.0,932429090,gestio@aptibus.com,,08040,46224.0,SOC,Contacteu amb l'entitat,4.0
